question,answer
What are the visiting hours at the hospital?,Hospital visiting hours are 10 AM to 8 PM daily. ICU visiting hours are 11 AM to 12 PM and 5 PM to 6 PM twice daily.
How do I schedule an appointment?,You can schedule an appointment by calling our main line at (+255)711549571, visiting our website, or using our mobile app. Walk-ins are also welcome.
What should I bring for my first visit?,Please bring a valid ID, insurance card, and any previous medical records. Arrive 15 minutes early to complete paperwork.
Are emergency services available 24/7?,Yes, our Emergency Department is open 24/7 for urgent medical conditions. For non-emergencies, please visit our urgent care center during business hours.
What is the cost of treatment?,Treatment costs vary based on the service. We accept most major insurance plans. Contact our billing department at (555) 123-6789 for specific cost estimates.
How long does surgery typically take?,Surgery duration depends on the procedure. Your surgeon will provide an estimated time before the operation. Recovery time varies as well.
Can I get a copy of my medical records?,Yes, you can request medical records from our Records Department. Submit a written request and we will provide copies within 5-7 business days.
What to do in case of fever?,Monitor your temperature. Rest, drink fluids, and take over-the-counter fever reducers. Seek medical attention if fever persists over 3 days or exceeds 103°F.
How is COVID-19 treated?,Most cases are managed with rest, fluids, and monitoring at home. Severe cases may require hospitalization and oxygen support. Consult a doctor for proper diagnosis.
What are the symptoms of a heart attack?,Chest pain or pressure, shortness of breath, pain in arms/neck/jaw, and dizziness. Call emergency services immediately if you experience these symptoms.
How do I manage diabetes?,Diabetes management includes medication, regular blood sugar monitoring, a healthy diet, exercise, and regular medical checkups. Consult an endocrinologist for personalized care.
What are vaccination requirements?,Vaccinations depend on age and health status. Our pediatric and adult medicine departments provide routine and specialized vaccines. Contact us for a vaccination schedule.
How can I reduce high blood pressure?,Lower blood pressure through regular exercise, reducing salt intake, maintaining a healthy weight, managing stress, and taking prescribed medications consistently.
What should I do before surgery?,Follow pre-operative instructions including fasting (usually 6-8 hours), stopping certain medications, and arranging transportation. Our team will provide detailed instructions.
When should I visit the emergency room?,Visit ER for chest pain, severe injuries, difficulty breathing, severe allergic reactions, signs of stroke, or any life-threatening condition.
What are the symptoms of malaria?,Common symptoms include fever, chills, headache, sweating, fatigue, nausea, and muscle pain. Seek medical care if symptoms are severe.
How is malaria treated?,Malaria is treated with antimalarial medications prescribed by a doctor. Early diagnosis and treatment are important to prevent complications.
What causes high fever?,High fever may be caused by infections such as flu, malaria, COVID-19, or bacterial infections. Medical evaluation is recommended if fever is persistent.
What are the symptoms of pneumonia?,Symptoms include cough with mucus, chest pain, fever, chills, and difficulty breathing. Severe cases require hospitalization.
How can I prevent flu?,Prevent flu by getting vaccinated annually, washing hands frequently, avoiding close contact with sick individuals, and maintaining good hygiene.
What are the symptoms of asthma?,Asthma symptoms include wheezing, shortness of breath, chest tightness, and coughing, especially at night or early morning.
How is asthma managed?,Asthma is managed using inhalers, avoiding triggers, monitoring symptoms, and following a doctor’s treatment plan.
What are the signs of dehydration?,Signs include dry mouth, extreme thirst, dark urine, dizziness, fatigue, and decreased urination.
What are common symptoms of typhoid?,Symptoms include prolonged fever, weakness, stomach pain, headache, and loss of appetite. Seek medical treatment immediately.
How is high cholesterol managed?,Management includes healthy diet, regular exercise, weight control, and medications such as statins if prescribed.
What are the warning signs of stroke?,Sudden numbness, confusion, trouble speaking, vision problems, severe headache, or difficulty walking. Seek emergency help immediately.
What causes stomach ulcers?,Stomach ulcers are often caused by Helicobacter pylori infection or long-term use of pain relievers like NSAIDs.
What are the symptoms of kidney infection?,Symptoms include back pain, fever, chills, nausea, frequent urination, and pain during urination.
How can I boost my immune system?,Maintain a balanced diet, exercise regularly, get enough sleep, reduce stress, and stay hydrated.
What are the symptoms of anemia?,Symptoms include fatigue, weakness, pale skin, dizziness, shortness of breath, and cold hands or feet.
What causes migraine headaches?,Migraines may be triggered by stress, hormonal changes, certain foods, lack of sleep, or bright lights.
How is food poisoning treated?,Treatment includes rest, hydration, oral rehydration solutions, and medical attention if symptoms are severe or persistent.
What are the symptoms of tuberculosis?,Persistent cough lasting more than 3 weeks, chest pain, weight loss, night sweats, and fever.
How can I manage arthritis pain?,Management includes exercise, weight control, medications, physical therapy, and lifestyle modifications.
What are the early symptoms of pregnancy?,Common early signs include missed period, nausea, breast tenderness, fatigue, and frequent urination.
how can i prevent diabetes?,prevent diabetes by maintaining a healthy weight, eating a balanced diet, exercising regularly, avoiding tobacco use, and managing stress effectively.
How do I request an interpreter?,We provide interpreter services on request; contact Patient Services at (555) 123-4567 at least 48 hours before your appointment.
Is parking available at the hospital?,Yes, parking is available for patients and visitors in the main parking lot; short-term drop-off is at the main entrance.
How can I pay my hospital bill?,You can pay bills online through the patient portal, by phone, or at the Billing Office; payment plans are available.
Do you accept my insurance?,We accept most major insurance plans; contact your insurer or call our billing team with your policy details to confirm coverage.
How do I get my lab or imaging results?,Results are posted to the patient portal when finalized; you can also call your provider's office for result summaries.
Are pediatric services available?,Yes, we offer comprehensive pediatric care including well-child visits, immunizations, outpatient specialty care, and inpatient services.
What is the hospital's organ donation policy?,We support organ and tissue donation; speak with our transplant coordinator or request information through Admissions.
Can I bring my own medications when admitted?,Inform nursing staff and bring original containers; the pharmacy will review and approve any personal medications.
How should I prepare for an MRI?,Remove all metal objects and jewelry, inform staff of implants or pregnancy, and follow any fasting instructions if provided.
What mental health services do you offer?,We offer counseling, psychiatry, crisis intervention, and referral services for inpatient and outpatient mental health care.
